sentence,feature,disagreeing_pairs,label_Gold,label_Razan,label_Tilly
"But I think- And after that I was- Cause m- m- I- I can say RD-WORK-3 was like, one of the best jobs I ever had.",zero-rel-pronoun,Gold‚Č†Razan,1,0.0,
But I was- this was like the third year I was there.,zero-rel-pronoun,Gold‚Č†Razan,1,0.0,
"But after a while, I- I guess the performance- um, my performance, uh, he took a liking to.",zero-rel-pronoun,Gold‚Č†Razan,1,0.0,
But how you feel don't matter at the time because you gotta figure the decisions you make is gonna affect other people and the business.,zero-rel-pronoun,Gold‚Č†Razan,1,0.0,
But one thing I wanted to mention though.,zero-rel-pronoun,Gold‚Č†Razan,1,0.0,
But then my health went to failing me.,zero-rel-pronoun,"Gold‚Č†Tilly, Razan‚Č†Tilly",0,0.0,1.0
"Cause I watch what- like I said what my older brother and my older sister all the trouble they got into, I was like, nah I'm'a do the exact opposite.",zero-rel-pronoun,Gold‚Č†Razan,1,0.0,
"Cause they- they was from- I can't- forgot what city they was from, but it was nowhere near DC of course.",zero-rel-pronoun,Gold‚Č†Razan,1,0.0,
Do I think they gonna go far with the team they got?,zero-rel-pronoun,Gold‚Č†Razan,1,0.0,
"Every decision you make, you gotta be, how would it benefit the organization I'm working for?",zero-rel-pronoun,Gold‚Č†Razan,1,0.0,
"Every little instance we had during practice, temper tantrum.",zero-rel-pronoun,Gold‚Č†Razan,1,0.0,
Game like that they should be dominate- And it's good that they have a bye this week all the injuries they got.,zero-rel-pronoun,Gold‚Č†Razan,1,0.0,
"I feel it is because- Of course some of the songs they do are like, cover songs of other artists.",zero-rel-pronoun,Gold‚Č†Razan,1,0.0,
"I heard a call over the radio about a- um, a guest needs assistance.",zero-rel-pronoun,Gold‚Č†Razan,0,1.0,
"I mean, and as far as activities we played tag, football, basketball.",zero-rel-pronoun,"Gold‚Č†Razan, Gold‚Č†Tilly",1,0.0,0.0
"I mean, cause you don't wanna get to a point where your- um, your wedding is about how many people you bring to the wedding.",zero-rel-pronoun,Gold‚Č†Razan,1,0.0,
"I mean, that's the first time I ever- um, first and only time actually I ever had to, um, perform CPR.",zero-rel-pronoun,Gold‚Č†Razan,1,0.0,
"I mean, that's the only thing I can say he ever taught me was- All the wrong he done I didn't wanna dabble in it.",zero-rel-pronoun,"Gold‚Č†Razan, Gold‚Č†Tilly",1,0.0,0.0
I said but I haven't did that work.,zero-rel-pronoun,"Gold‚Č†Tilly, Razan‚Č†Tilly",0,0.0,1.0
"I said, you haven't ate?",zero-rel-pronoun,Gold‚Č†Tilly,0,,1.0
"It was like a wooded area we went up, it was like on a hill.",zero-rel-pronoun,Gold‚Č†Razan,1,0.0,
Not as much I was as a child.,zero-rel-pronoun,Gold‚Č†Razan,0,1.0,
Only thing you putting in there carry outs and liquor stores.,zero-rel-pronoun,Gold‚Č†Razan,1,0.0,
Other people started finding out I can cook so I been doing it for like the last four years.,zero-rel-pronoun,"Gold‚Č†Razan, Razan‚Č†Tilly",0,1.0,0.0
"She hadn't been uh, got here from Seattle, Washington.",zero-rel-pronoun,Gold‚Č†Tilly,0,,1.0
"So I aksed her, I was like, well, um, if there's anything we can do to help, just let me know.",zero-rel-pronoun,Gold‚Č†Razan,1,0.0,
"So any little thing he done did, she was on top of 'em.",zero-rel-pronoun,Gold‚Č†Razan,1,0.0,
So whatever guidelines the organization has those what you gotta follow.,zero-rel-pronoun,Gold‚Č†Razan,1,0.0,
"So, that little shell you in, you quickly come out of it.",zero-rel-pronoun,Gold‚Č†Razan,1,0.0,
"So- and- and m- and me personally I don't think it's for our benefit they building these new developments because if you go down t- Man, I- where- where'd I drive to?",zero-rel-pronoun,Gold‚Č†Razan,0,1.0,
"That was one of the most positive people I've ever met, man.",zero-rel-pronoun,Gold‚Č†Razan,1,0.0,
"The ones I do, we're really close.",zero-rel-pronoun,Gold‚Č†Razan,1,0.0,
"The water had did it, so I didn't even recognize it.",zero-rel-pronoun,Gold‚Č†Tilly,0,,1.0
The- RD-NAME-2 the c- the circle I hung around and still hang around I really never hung around nobody that was- that I'm close to that got into like situations like that or put theirself in position to be in- in that situation.,zero-rel-pronoun,Gold‚Č†Razan,1,0.0,
"Uh, it's one 'em got a more tangy like, tastes like barbecue- close to barbecue type flavor.",zero-rel-pronoun,Gold‚Č†Razan,1,0.0,
"Uh, y- know what, you're absolutely right because it g- it might get to a point your team has no identity at all.",zero-rel-pronoun,Gold‚Č†Razan,0,1.0,
"Uh-huh cause some of 'em was down to the town hall, the old town hall.",zero-rel-pronoun,Gold‚Č†Tilly,0,,1.0
"Um, I mean, the most fun I ever had was in junior high school, I mean because in elementary school I was kind of quiet, laid back.",zero-rel-pronoun,Gold‚Č†Razan,1,0.0,
"Um, initially, I mean, I- I di- I'm not gonna say I was a expert, but he- the guy I was working for thought I was.",zero-rel-pronoun,Gold‚Č†Razan,1,0.0,
"Um, telling me about their problems they had with drug addiction, uh, with they kids.",zero-rel-pronoun,Gold‚Č†Razan,1,0.0,
Well I didn't- that's the number I didn't wanna go over.,zero-rel-pronoun,Gold‚Č†Razan,1,0.0,
"Yeah it was, um, at- um, directly across the street was the junior high school I went to, it's RD-SCHOOL-5.",zero-rel-pronoun,Gold‚Č†Razan,1,0.0,
