And I think the coach that I had there we didn't really s- I guess see eye to eye on certain things because he wanted me to play a position I didn't wanna play.,,,,zero-rel-pronoun,,,,1.0,0.0,,,,,,,,,,,,,,,,,,,,,,,,,,,,,,,,,,,,,,,,,,,,,,,,,,,,,,,,,,
"And cause you, I guess, figure you- you have the mindset it's no consequences for your actions at all.",,,,zero-rel-pronoun,,,,0.0,1.0,,,,,,,,,,,,,,,,,,,,,,,,,,,,,,,,,,,,,,,,,,,,,,,,,,,,,,,,,,
"And he saw her and he was like, good job on the report you did yesterday.",,,,zero-rel-pronoun,,,,1.0,0.0,,,,,,,,,,,,,,,,,,,,,,,,,,,,,,,,,,,,,,,,,,,,,,,,,,,,,,,,,,
"And they had a rec center, RD-SCHOOL-2 rec that like all the surrounding neighborhoods went to.",,,,zero-rel-pronoun,,,,1.0,0.0,,,,,,,,,,,,,,,,,,,,,,,,,,,,,,,,,,,,,,,,,,,,,,,,,,,,,,,,,,
And those just the ones I came in contact with.,,,,zero-rel-pronoun,,,,1.0,0.0,,,,,,,,,,,,,,,,,,,,,,,,,,,,,,,,,,,,,,,,,,,,,,,,,,,,,,,,,,
Because everybody I knew from junior high school and everybody in my neighborhood went to RD-SCHOOL-2 because it was closer.,,,,zero-rel-pronoun,,,,1.0,0.0,,,,,,,,,,,,,,,,,,,,,,,,,,,,,,,,,,,,,,,,,,,,,,,,,,,,,,,,,,
"Because of course now, the height I'm at now, if I was going to the NBA I'm considered short.",,,,zero-rel-pronoun,,,,1.0,0.0,,,,,,,,,,,,,,,,,,,,,,,,,,,,,,,,,,,,,,,,,,,,,,,,,,,,,,,,,,
"Because the neighborhood I grew up in, looking at it now, now that I'm older, yeah it was, uh, pretty rough.",,,,zero-rel-pronoun,,,,1.0,0.0,,,,,,,,,,,,,,,,,,,,,,,,,,,,,,,,,,,,,,,,,,,,,,,,,,,,,,,,,,
"But I think- And after that I was- Cause m- m- I- I can say RD-WORK-3 was like, one of the best jobs I ever had.",,,,zero-rel-pronoun,,,,1.0,0.0,,,,,,,,,,,,,,,,,,,,,,,,,,,,,,,,,,,,,,,,,,,,,,,,,,,,,,,,,,
But I was- this was like the third year I was there.,,,,zero-rel-pronoun,,,,1.0,0.0,,,,,,,,,,,,,,,,,,,,,,,,,,,,,,,,,,,,,,,,,,,,,,,,,,,,,,,,,,
"But after a while, I- I guess the performance- um, my performance, uh, he took a liking to.",,,,zero-rel-pronoun,,,,1.0,0.0,,,,,,,,,,,,,,,,,,,,,,,,,,,,,,,,,,,,,,,,,,,,,,,,,,,,,,,,,,
But how you feel don't matter at the time because you gotta figure the decisions you make is gonna affect other people and the business.,,,,zero-rel-pronoun,,,,1.0,0.0,,,,,,,,,,,,,,,,,,,,,,,,,,,,,,,,,,,,,,,,,,,,,,,,,,,,,,,,,,
But one thing I wanted to mention though.,,,,zero-rel-pronoun,,,,1.0,0.0,,,,,,,,,,,,,,,,,,,,,,,,,,,,,,,,,,,,,,,,,,,,,,,,,,,,,,,,,,
"Every decision you make, you gotta be, how would it benefit the organization I'm working for?",,,,zero-rel-pronoun,,,,1.0,0.0,,,,,,,,,,,,,,,,,,,,,,,,,,,,,,,,,,,,,,,,,,,,,,,,,,,,,,,,,,
"Every little instance we had during practice, temper tantrum.",,,,zero-rel-pronoun,,,,1.0,0.0,,,,,,,,,,,,,,,,,,,,,,,,,,,,,,,,,,,,,,,,,,,,,,,,,,,,,,,,,,
Game like that they should be dominate- And it's good that they have a bye this week all the injuries they got.,,,,zero-rel-pronoun,,,,1.0,0.0,,,,,,,,,,,,,,,,,,,,,,,,,,,,,,,,,,,,,,,,,,,,,,,,,,,,,,,,,,
"I feel it is because- Of course some of the songs they do are like, cover songs of other artists.",,,,zero-rel-pronoun,,,,1.0,0.0,,,,,,,,,,,,,,,,,,,,,,,,,,,,,,,,,,,,,,,,,,,,,,,,,,,,,,,,,,
"I heard a call over the radio about a- um, a guest needs assistance.",,,,zero-rel-pronoun,,,,0.0,1.0,,,,,,,,,,,,,,,,,,,,,,,,,,,,,,,,,,,,,,,,,,,,,,,,,,,,,,,,,,
"I mean, and as far as activities we played tag, football, basketball.",,,,zero-rel-pronoun,,,,1.0,0.0,0.0,,,,,,,,,,,,,,,,,,,,,,,,,,,,,,,,,,,,,,,,,,,,,,,,,,,,,,,,,
"I mean, cause you don't wanna get to a point where your- um, your wedding is about how many people you bring to the wedding.",,,,zero-rel-pronoun,,,,1.0,0.0,,,,,,,,,,,,,,,,,,,,,,,,,,,,,,,,,,,,,,,,,,,,,,,,,,,,,,,,,,
"I mean, that's the first time I ever- um, first and only time actually I ever had to, um, perform CPR.",,,,zero-rel-pronoun,,,,1.0,0.0,,,,,,,,,,,,,,,,,,,,,,,,,,,,,,,,,,,,,,,,,,,,,,,,,,,,,,,,,,
"I mean, that's the only thing I can say he ever taught me was- All the wrong he done I didn't wanna dabble in it.",,,,zero-rel-pronoun,,,,1.0,0.0,0.0,,,,,,,,,,,,,,,,,,,,,,,,,,,,,,,,,,,,,,,,,,,,,,,,,,,,,,,,,
"It was like a wooded area we went up, it was like on a hill.",,,,zero-rel-pronoun,,,,1.0,0.0,,,,,,,,,,,,,,,,,,,,,,,,,,,,,,,,,,,,,,,,,,,,,,,,,,,,,,,,,,
Not as much I was as a child.,,,,zero-rel-pronoun,,,,0.0,1.0,,,,,,,,,,,,,,,,,,,,,,,,,,,,,,,,,,,,,,,,,,,,,,,,,,,,,,,,,,
Only thing you putting in there carry outs and liquor stores.,,,,zero-rel-pronoun,,,,1.0,0.0,,,,,,,,,,,,,,,,,,,,,,,,,,,,,,,,,,,,,,,,,,,,,,,,,,,,,,,,,,
"So I aksed her, I was like, well, um, if there's anything we can do to help, just let me know.",,,,zero-rel-pronoun,,,,1.0,0.0,,,,,,,,,,,,,,,,,,,,,,,,,,,,,,,,,,,,,,,,,,,,,,,,,,,,,,,,,,
"So any little thing he done did, she was on top of 'em.",,,,zero-rel-pronoun,,,,1.0,0.0,,,,,,,,,,,,,,,,,,,,,,,,,,,,,,,,,,,,,,,,,,,,,,,,,,,,,,,,,,
So whatever guidelines the organization has those what you gotta follow.,,,,zero-rel-pronoun,,,,1.0,0.0,,,,,,,,,,,,,,,,,,,,,,,,,,,,,,,,,,,,,,,,,,,,,,,,,,,,,,,,,,
"So, that little shell you in, you quickly come out of it.",,,,zero-rel-pronoun,,,,1.0,0.0,,,,,,,,,,,,,,,,,,,,,,,,,,,,,,,,,,,,,,,,,,,,,,,,,,,,,,,,,,
"That was one of the most positive people I've ever met, man.",,,,zero-rel-pronoun,,,,1.0,0.0,,,,,,,,,,,,,,,,,,,,,,,,,,,,,,,,,,,,,,,,,,,,,,,,,,,,,,,,,,
"The ones I do, we're really close.",,,,zero-rel-pronoun,,,,1.0,0.0,,,,,,,,,,,,,,,,,,,,,,,,,,,,,,,,,,,,,,,,,,,,,,,,,,,,,,,,,,
The- RD-NAME-2 the c- the circle I hung around and still hang around I really never hung around nobody that was- that I'm close to that got into like situations like that or put theirself in position to be in- in that situation.,,,,zero-rel-pronoun,,,,1.0,0.0,,,,,,,,,,,,,,,,,,,,,,,,,,,,,,,,,,,,,,,,,,,,,,,,,,,,,,,,,,
"Uh, it's one 'em got a more tangy like, tastes like barbecue- close to barbecue type flavor.",,,,zero-rel-pronoun,,,,1.0,0.0,,,,,,,,,,,,,,,,,,,,,,,,,,,,,,,,,,,,,,,,,,,,,,,,,,,,,,,,,,
"Uh, y- know what, you're absolutely right because it g- it might get to a point your team has no identity at all.",,,,zero-rel-pronoun,,,,0.0,1.0,,,,,,,,,,,,,,,,,,,,,,,,,,,,,,,,,,,,,,,,,,,,,,,,,,,,,,,,,,
"Um, I mean, the most fun I ever had was in junior high school, I mean because in elementary school I was kind of quiet, laid back.",,,,zero-rel-pronoun,,,,1.0,0.0,,,,,,,,,,,,,,,,,,,,,,,,,,,,,,,,,,,,,,,,,,,,,,,,,,,,,,,,,,
"Um, initially, I mean, I- I di- I'm not gonna say I was a expert, but he- the guy I was working for thought I was.",,,,zero-rel-pronoun,,,,1.0,0.0,,,,,,,,,,,,,,,,,,,,,,,,,,,,,,,,,,,,,,,,,,,,,,,,,,,,,,,,,,
"Um, telling me about their problems they had with drug addiction, uh, with they kids.",,,,zero-rel-pronoun,,,,1.0,0.0,,,,,,,,,,,,,,,,,,,,,,,,,,,,,,,,,,,,,,,,,,,,,,,,,,,,,,,,,,
Well I didn't- that's the number I didn't wanna go over.,,,,zero-rel-pronoun,,,,1.0,0.0,,,,,,,,,,,,,,,,,,,,,,,,,,,,,,,,,,,,,,,,,,,,,,,,,,,,,,,,,,
"Yeah it was, um, at- um, directly across the street was the junior high school I went to, it's RD-SCHOOL-5.",,,,zero-rel-pronoun,,,,1.0,0.0,,,,,,,,,,,,,,,,,,,,,,,,,,,,,,,,,,,,,,,,,,,,,,,,,,,,,,,,,,
